{
  "event_id": "019c1f5a-c405-7d4b-95e8-61847f78fe5a",
  "event_type": "article.discovered",
  "schema_version": 1,
  "occurred_at": "2026-07-31T02:00:00Z",
  "producer": "crawler-service",
  "correlation_id": "019c1f5a-c405-7d4b-95e8-61847f78fe5b",
  "causation_id": "019c1f5a-c405-7d4b-95e8-61847f78fe5c",
  "aggregate_id": "019c1f5a-c405-7d4b-95e8-61847f78fe5d",
  "traceparent": "00-4bf92f3577b34da6a3ce929d0e0e4736-00f067aa0ba902b7-01",
  "payload": {
    "discovery_id": "019c1f5a-c405-7d4b-95e8-61847f78fe5d",
    "source_id": "019c1f5a-c405-7d4b-95e8-61847f78fe5e",
    "crawl_batch_id": "019c1f5a-c405-7d4b-95e8-61847f78fe5f",
    "source_name": "FootballPulse Mock",
    "source_domain": "mock-news-source",
    "original_url": "http://mock-news-source:8080/articles/transfer-1",
    "canonical_url_hint": "http://mock-news-source:8080/articles/transfer-1",
    "original_title": "Manchester United quan tâm tiền đạo Example",
    "parsed_content": "Manchester United được cho là đang quan tâm tiền đạo Example.",
    "author": "Mock Reporter",
    "published_at": "2026-07-31T01:30:00Z",
    "collected_at": "2026-07-31T02:00:00Z",
    "language": "vi",
    "http_status": 200,
    "content_type": "text/html; charset=utf-8",
    "response_headers": {
      "etag": "\"fixture-transfer-1-v1\"",
      "last-modified": "Thu, 31 Jul 2026 01:30:00 GMT",
      "content-language": "vi"
    }
  }
}
